{
  "schema_version": "2.0.0",
  "artifact_version": "v003",
  "policy_map_version": "v002",
  "status": "STAGING_OWNER_APPROVED",
  "acceptance_binding": {
    "path": "data/rag-v3/review/acceptance/v003/owner-source-family-policy-acceptance.json",
    "sha256": "fc88af885943bf0d3c91d2a1c3338e6c40faf197ef642fbba79d17a8965eeffc",
    "acceptance_version": "v003",
    "scope": "STAGING_SOURCE_FAMILY_POLICY_V002"
  },
  "audit_preflight_binding": {
    "inventory_path": "data/rag-v3/governance/source-family-policy/preflight/v002/validation-input-inventory.json",
    "inventory_sha256": "98dafdf99f8c32105d564ea6750ce9b07c854184b1294699595ad7216a29e4b7",
    "prior_lock_path": "data/rag-v3/governance/source-family-policy/preflight/v002/prior-artifact-lock.json",
    "prior_lock_sha256": "8daec8dfd7f2593f0b13544b6a7ad71b9788fdcf96b07dc07aec0f701decdc1b"
  },
  "candidate_binding": {
    "path": "data/rag-v3/candidates/v003",
    "checksums_sha256": "8dc7fc5268dc35df4b0cd9f8b8a380761ddfdf3a0e06360d2cc0ebe8977e55c3",
    "candidate_lock_path": "data/rag-v3/audits/v001/preflight/candidate-artifact-lock.json",
    "candidate_lock_sha256": "8414cc1e8acc8bd51f064c65218fccecf89e4eeda55b63fce2f927e33c055348",
    "source_manifest_path": "data/rag-v3/candidates/v003/manifests/source-manifest-v003.json",
    "source_manifest_sha256": "f6fd368eae83573574172a97cadcf75b0cf297c263e3fd0cfe7ba1b09c999ecc",
    "source_count": 17,
    "chunk_count": 726
  },
  "prior_policy_binding": {
    "path": "data/rag-v3/governance/source-family-policy/candidates/v001/source-family-policy-map.json",
    "sha256": "d877324aee592b1c4b22d7878aefcad1a806ea5970bcb7b612a63adc15bf70ef",
    "policy_map_version": "v001",
    "relationship": "SUPERSEDES_POLICY_WITHOUT_MUTATING_PRIOR_BYTES"
  },
  "global_policy": {
    "ordinary_public_retrieval_audiences": [
      "elder",
      "family_caregiver",
      "care_professional",
      "system_admin"
    ],
    "retrieve_before_response_policy": true,
    "ordinary_retrieval_current_status": "current",
    "ordinary_retrieval_risk_levels": [
      "low",
      "medium"
    ],
    "ordinary_retrieval_stop_normal_rag": false,
    "missing_license_url_automatic_block": false,
    "project_use_authorization_required": true,
    "purpose_response_gate": "EVALUATE_AFTER_RETRIEVAL",
    "assessment_response_gate": "EVALUATE_AFTER_RETRIEVAL_NULL_DENIES_RESPONSE",
    "high_or_unknown_normal_rag": "DENY",
    "research_route": "INDEPENDENT_RESEARCH_REVIEW_REQUIRED",
    "runtime_safety_from_embedding_similarity": false,
    "automatic_official_assessment": false,
    "automatic_professional_assessment": false,
    "production_approved": false
  },
  "chunk_risk_decisions": [
    {
      "chunk_id": "mohw_home_care_service_supervisor_manual_forms_appendix_20260529_rag_v3_v003_0001",
      "source_id": "mohw_home_care_service_supervisor_manual_forms_appendix_20260529",
      "prior_risk_level": null,
      "effective_risk_level": "low",
      "owner_label": "一般風險值",
      "decision_basis": "OWNER_GENERAL_RISK_CLASSIFICATION_TO_CANONICAL_LOW",
      "acceptance_path": "data/rag-v3/review/acceptance/v003/owner-source-family-policy-acceptance.json",
      "acceptance_sha256": "fc88af885943bf0d3c91d2a1c3338e6c40faf197ef642fbba79d17a8965eeffc",
      "review_status": "verified",
      "formal_assessment_performed": false,
      "production_approved": false
    },
    {
      "chunk_id": "mohw_home_care_service_supervisor_manual_forms_appendix_20260529_rag_v3_v003_0002",
      "source_id": "mohw_home_care_service_supervisor_manual_forms_appendix_20260529",
      "prior_risk_level": null,
      "effective_risk_level": "low",
      "owner_label": "一般風險值",
      "decision_basis": "OWNER_GENERAL_RISK_CLASSIFICATION_TO_CANONICAL_LOW",
      "acceptance_path": "data/rag-v3/review/acceptance/v003/owner-source-family-policy-acceptance.json",
      "acceptance_sha256": "fc88af885943bf0d3c91d2a1c3338e6c40faf197ef642fbba79d17a8965eeffc",
      "review_status": "verified",
      "formal_assessment_performed": false,
      "production_approved": false
    },
    {
      "chunk_id": "mohw_home_care_service_supervisor_manual_forms_appendix_20260529_rag_v3_v003_0003",
      "source_id": "mohw_home_care_service_supervisor_manual_forms_appendix_20260529",
      "prior_risk_level": null,
      "effective_risk_level": "low",
      "owner_label": "一般風險值",
      "decision_basis": "OWNER_GENERAL_RISK_CLASSIFICATION_TO_CANONICAL_LOW",
      "acceptance_path": "data/rag-v3/review/acceptance/v003/owner-source-family-policy-acceptance.json",
      "acceptance_sha256": "fc88af885943bf0d3c91d2a1c3338e6c40faf197ef642fbba79d17a8965eeffc",
      "review_status": "verified",
      "formal_assessment_performed": false,
      "production_approved": false
    },
    {
      "chunk_id": "mohw_home_care_service_supervisor_manual_forms_appendix_20260529_rag_v3_v003_0004",
      "source_id": "mohw_home_care_service_supervisor_manual_forms_appendix_20260529",
      "prior_risk_level": null,
      "effective_risk_level": "low",
      "owner_label": "一般風險值",
      "decision_basis": "OWNER_GENERAL_RISK_CLASSIFICATION_TO_CANONICAL_LOW",
      "acceptance_path": "data/rag-v3/review/acceptance/v003/owner-source-family-policy-acceptance.json",
      "acceptance_sha256": "fc88af885943bf0d3c91d2a1c3338e6c40faf197ef642fbba79d17a8965eeffc",
      "review_status": "verified",
      "formal_assessment_performed": false,
      "production_approved": false
    },
    {
      "chunk_id": "mohw_home_care_service_supervisor_manual_forms_appendix_20260529_rag_v3_v003_0005",
      "source_id": "mohw_home_care_service_supervisor_manual_forms_appendix_20260529",
      "prior_risk_level": null,
      "effective_risk_level": "low",
      "owner_label": "一般風險值",
      "decision_basis": "OWNER_GENERAL_RISK_CLASSIFICATION_TO_CANONICAL_LOW",
      "acceptance_path": "data/rag-v3/review/acceptance/v003/owner-source-family-policy-acceptance.json",
      "acceptance_sha256": "fc88af885943bf0d3c91d2a1c3338e6c40faf197ef642fbba79d17a8965eeffc",
      "review_status": "verified",
      "formal_assessment_performed": false,
      "production_approved": false
    }
  ],
  "source_policies": [
    {
      "source_id": "fetzer_ucla_loneliness_scale_compendium",
      "title": "Fetzer／UCLA 孤獨量表",
      "source_type": "assessment_scale",
      "is_official_source": false,
      "distribution_scope": "research_evidence",
      "evidence": {
        "chunk_file_path": "data/rag-v3/candidates/v003/chunks/fetzer_ucla_loneliness_scale_compendium.rag-chunk-v3.v003.jsonl",
        "chunk_file_sha256": "bf5090b95205a1588fd9b767487744ac30003771cc5b8e0b19ceeb1d23b37bfb",
        "source_manifest_path": "data/rag-v3/candidates/v003/manifests/source-manifest-v003.json",
        "direct_source_urls": [
          "https://backend.fetzer.org/sites/default/files/images/stories/pdf/selfmeasures/Self_Measures_for_Love_and_Compassion_Research_LONELINESS_AND_INTERPERSONAL_PROBLEMS.pdf"
        ],
        "official_source_page_urls": [],
        "license_evidence_urls": [],
        "storage_urls": [],
        "local_raw_source_bytes_available": false
      },
      "project_use_authorization": {
        "status": "OWNER_REVIEWED_PUBLIC_USE",
        "scope": "STAGING_PROJECT_USE",
        "acceptance_path": "data/rag-v3/review/acceptance/v003/owner-source-family-policy-acceptance.json",
        "acceptance_sha256": "fc88af885943bf0d3c91d2a1c3338e6c40faf197ef642fbba79d17a8965eeffc",
        "missing_license_url_automatic_block": false,
        "license_status_mutated": false
      },
      "policy_decision": {
        "retrieval_audiences": [
          "elder",
          "family_caregiver",
          "care_professional",
          "system_admin"
        ],
        "allowed_purposes": [
          "human_administered_assessment_design",
          "research_reference",
          "scale_explanation"
        ],
        "ordinary_retrieval_source_status": "INDEPENDENT_RESEARCH_ROUTE_ONLY",
        "audience_handling": "SOURCE_POLICY_GRANTS_PUBLIC_ROLES_RESPONSE_POLICY_STILL_REQUIRED",
        "purpose_handling": "EVALUATE_AFTER_RETRIEVAL",
        "assessment_handling": "EVALUATE_AFTER_RETRIEVAL_NULL_DENIES_RESPONSE",
        "risk_handling": "LOW_MEDIUM_ONLY_HIGH_UNKNOWN_DENY",
        "stop_normal_rag_handling": "FALSE_ONLY_TRUE_OR_NULL_DENY",
        "license_handling": "OWNER_PUBLIC_USE_REVIEW_MISSING_URL_NOT_AUTOMATIC_BLOCK",
        "citation_required": true,
        "diagnosis_allowed": false
      },
      "observed_summary": {
        "chunk_count": 10,
        "risk_observed": {
          "low": 10,
          "medium": 0,
          "high": 0,
          "high_red_line": 0,
          "unclassified": 0
        },
        "risk_effective": {
          "low": 10,
          "medium": 0,
          "high": 0,
          "high_red_line": 0,
          "unclassified": 0
        },
        "current_status": {
          "current": 10,
          "superseded": 0,
          "unknown": 0
        },
        "stop_normal_rag": {
          "true_count": 0,
          "false_count": 10,
          "null_count": 0
        },
        "assessment_null": {
          "official": 0,
          "professional": 0
        },
        "risk_decision_count": 0,
        "ordinary_retrieval_candidate_count": 0,
        "response_metadata_ready_count": 0
      },
      "remaining_requirements": [
        "GOLDEN_QUERY_REQUIRED",
        "INDEPENDENT_RESEARCH_ROUTE_VALIDATION_REQUIRED"
      ],
      "review_status": "verified",
      "production_approved": false
    },
    {
      "source_id": "frontiers_do_words_matter_loneliness_nlp_2021",
      "title": "Do Words Matter NLP 研究",
      "source_type": "research_article",
      "is_official_source": false,
      "distribution_scope": "research_evidence",
      "evidence": {
        "chunk_file_path": "data/rag-v3/candidates/v003/chunks/frontiers_do_words_matter_loneliness_nlp_2021.rag-chunk-v3.v003.jsonl",